{
  "schema_version": "1.0",
  "surface": {
    "channel": "telegram",
    "chat_type": "private",
    "locale": "en",
    "is_draft": false,
    "capabilities": {
      "rich_blocks": true,
      "rich_markdown": true,
      "rich_html": true,
      "legacy_html": true,
      "legacy_markdown": true,
      "plain_album": true,
      "media_spoiler": true,
      "details_nested_media": true,
      "controlled_local_upload": false
    }
  },
  "selection": {
    "mode": "rich",
    "pattern": "second-narrator-notes",
    "density": "standard",
    "reason_codes": [
      "structure_improves_scan"
    ],
    "showcase_requested": false
  },
  "summary": "second narrator notes",
  "blocks": [
    {
      "type": "paragraph",
      "text": [
        {
          "type": "text",
          "text": "The primary account dates the change to morning. "
        },
        {
          "type": "reference",
          "name": "archive",
          "content": [
            {
              "type": "text",
              "text": "Archive timestamp: 08:42 UTC."
            }
          ]
        }
      ]
    },
    {
      "type": "paragraph",
      "text": [
        {
          "type": "text",
          "text": "A second observer reports no interruption. "
        },
        {
          "type": "reference",
          "name": "observer",
          "content": [
            {
              "type": "text",
              "text": "Observer note: service remained available."
            }
          ]
        }
      ]
    },
    {
      "type": "footer",
      "text": [
        {
          "type": "reference_link",
          "target": "archive",
          "content": [
            {
              "type": "text",
              "text": "Archive"
            }
          ]
        },
        {
          "type": "text",
          "text": " · "
        },
        {
          "type": "reference_link",
          "target": "observer",
          "content": [
            {
              "type": "text",
              "text": "Observer"
            }
          ]
        }
      ]
    }
  ],
  "media": [],
  "delivery": {
    "reply": "inherit",
    "thread": "inherit",
    "silent": false,
    "protect_content": false,
    "entity_detection": "explicit_only"
  },
  "fallback": {
    "ladder": [
      "rich_blocks",
      "rich_markdown",
      "rich_html",
      "legacy_html",
      "legacy_markdown",
      "plain_album"
    ],
    "allow_feature_loss": true,
    "on_unknown_delivery": "stop_and_reconcile"
  },
  "diagnostics": {
    "warnings": []
  }
}
