{
  "schema_version": "1.0",
  "surface": {
    "channel": "telegram",
    "chat_type": "private",
    "locale": "en",
    "is_draft": false,
    "capabilities": {
      "rich_blocks": true,
      "rich_markdown": true,
      "rich_html": true,
      "legacy_html": true,
      "legacy_markdown": true,
      "plain_album": true,
      "media_spoiler": true,
      "details_nested_media": true,
      "controlled_local_upload": false
    }
  },
  "selection": {
    "mode": "rich",
    "pattern": "interactive-redaction",
    "density": "standard",
    "reason_codes": [
      "structure_improves_scan"
    ],
    "showcase_requested": false
  },
  "summary": "interactive redaction",
  "blocks": [
    {
      "type": "paragraph",
      "text": [
        {
          "type": "text",
          "text": "Content note: the next phrase reveals the result. "
        },
        {
          "type": "spoiler",
          "content": [
            {
              "type": "text",
              "text": "The signal was expected."
            }
          ]
        }
      ]
    },
    {
      "type": "photo",
      "media_id": "reveal",
      "spoiler": true,
      "caption": {
        "text": "Related frame",
        "credit": "Archive"
      }
    }
  ],
  "media": [
    {
      "id": "reveal",
      "kind": "photo",
      "source": {
        "type": "telegram_file_id",
        "file_id": "telegram-reveal"
      }
    }
  ],
  "delivery": {
    "reply": "inherit",
    "thread": "inherit",
    "silent": false,
    "protect_content": false,
    "entity_detection": "explicit_only"
  },
  "fallback": {
    "ladder": [
      "rich_blocks",
      "rich_markdown",
      "rich_html",
      "legacy_html",
      "legacy_markdown",
      "plain_album"
    ],
    "allow_feature_loss": true,
    "on_unknown_delivery": "stop_and_reconcile"
  },
  "diagnostics": {
    "warnings": []
  }
}
