{
  "schema_version": "1.0",
  "surface": {
    "channel": "telegram",
    "chat_type": "private",
    "locale": "ru",
    "is_draft": false,
    "capabilities": {
      "rich_blocks": true,
      "rich_markdown": true,
      "rich_html": true,
      "legacy_html": true,
      "legacy_markdown": true,
      "plain_album": true,
      "media_spoiler": true,
      "details_nested_media": true,
      "controlled_local_upload": false
    }
  },
  "selection": {
    "mode": "rich",
    "pattern": "structured-answer",
    "density": "showcase",
    "reason_codes": [
      "user_requested_rich"
    ],
    "showcase_requested": true
  },
  "summary": "Коротко: программа тренировок готова 💪",
  "blocks": [
    {
      "type": "paragraph",
      "text": "Коротко: программа тренировок готова 💪"
    },
    {
      "type": "paragraph",
      "text": "Индекс: 🌅 Утром · 🌙 Вечером"
    },
    {
      "type": "details",
      "summary": "🌅 УТРОМ",
      "open": false,
      "blocks": [
        {
          "type": "list",
          "ordered": true,
          "items": [
            {
              "text": "ПРЕСС КАЧАТ"
            },
            {
              "text": "Т) БЕГИТ"
            },
            {
              "text": "ТУРНИК"
            },
            {
              "text": "АНЖУМАНЯ"
            }
          ]
        }
      ]
    },
    {
      "type": "details",
      "summary": "🌙 ВЕЧЕРОМ",
      "open": false,
      "blocks": [
        {
          "type": "list",
          "ordered": true,
          "items": [
            {
              "text": "ПРЕСС КАЧАТ"
            },
            {
              "text": "БЕГИТ"
            },
            {
              "text": "ТУРНИК"
            },
            {
              "text": "АНЖУМАНЯ"
            }
          ]
        }
      ]
    }
  ],
  "media": [],
  "delivery": {
    "reply": "inherit",
    "thread": "inherit",
    "silent": false,
    "protect_content": false,
    "entity_detection": "explicit_only"
  },
  "fallback": {
    "ladder": [
      "rich_blocks",
      "rich_markdown",
      "rich_html",
      "legacy_html",
      "legacy_markdown",
      "plain_album"
    ],
    "allow_feature_loss": true,
    "on_unknown_delivery": "stop_and_reconcile"
  },
  "diagnostics": {
    "warnings": []
  }
}
